{
  "version": 1,
  "meta": {
    "classId": "2",
    "subjectId": "math",
    "title": "Математика",
    "updated": "2025-03-01"
  },
  "paragraphs": [
    {
      "id": "add-sub-2digit",
      "title": "Сложение и вычитание двузначных чисел",
      "summary": "Двузначные числа складываются и вычитаются по разрядам: десятки отдельно, единицы отдельно. Можно использовать разложение на десятки и единицы.",
      "image": null,
      "sections": [],
      "dates": [],
      "terms": [
        { "id": "t-1", "term": "Двузначное число", "definition": "Число от 10 до 99, состоящее из десятков и единиц", "image": null },
        { "id": "t-2", "term": "Разряд десятков", "definition": "Первая цифра двузначного числа", "image": null },
        { "id": "t-3", "term": "Разряд единиц", "definition": "Вторая цифра двузначного числа", "image": null }
      ],
      "people": [],
      "quizzes": [
        { "id": "quiz-add-sub", "title": "Тест по сложению и вычитанию двузначных чисел", "source": "manual" }
      ]
    }
  ],
  "quizzes": [
    {
      "id": "quiz-add-sub",
      "title": "Тест: Сложение и вычитание двузначных чисел",
      "source": "manual",
      "difficulty": "medium",
      "questions": [
        {
          "type": "choice",
          "q": "Сколько будет 34 + 25?",
          "a": ["49", "59", "69", "54"],
          "c": 1
        },
        {
          "type": "input",
          "q": "Сколько будет 78 − 26?",
          "answer": "52"
        },
        {
          "type": "choice",
          "q": "Сколько будет 56 + 13?",
          "a": ["69", "63", "73", "59"],
          "c": 0
        },
        {
          "type": "choice",
          "q": "Сколько будет 44 + 29?",
          "a": ["49", "59", "73", "54"],
          "c": 2
        },
        {
          "type": "choice",
          "q": "Сколько будет 90 − 40?",
          "a": ["40", "60", "50", "30"],
          "c": 2
        },
        {
          "type": "input",
          "q": "Сколько будет 67 + 12?",
          "answer": "79"
        },
        {
          "type": "choice",
          "q": "Сколько будет 83 − 21?",
          "a": ["62", "72", "61", "63"],
          "c": 0
        },
        {
          "type": "choice",
          "q": "Сколько будет 45 + 34?",
          "a": ["69", "79", "89", "78"],
          "c": 1
        },
        {
          "type": "input",
          "q": "Сколько будет 92 − 30?",
          "answer": "62"
        },
        {
          "type": "choice",
          "q": "Сколько будет 28 + 41?",
          "a": ["69", "59", "79", "61"],
          "c": 0
        },
    
        {
          "type": "choice",
          "q": "У Маши было 24 конфеты. Мама дала ещё 15, а папа ещё 10. Сколько конфет стало у Маши?",
          "a": ["39", "49", "44", "45"],
          "c": 1
        },
        {
          "type": "input",
          "q": "В коробке было 68 карандашей. 20 карандашей взяли, потом добавили ещё 15. Сколько стало карандашей?",
          "answer": "63"
        },
        {
          "type": "choice",
          "q": "В саду росло 35 яблонь. Посадили ещё 23, а потом ещё 12. Сколько стало яблонь?",
          "a": ["60", "70", "80", "65"],
          "c": 1
        },
        {
          "type": "choice",
          "q": "В автобусе было 54 пассажира. На остановке вышли 12, а затем вошли 9. Сколько пассажиров стало?",
          "a": ["41", "51", "49", "45"],
          "c": 1
        },
        {
          "type": "input",
          "q": "У Пети было 47 наклеек. Он подарил другу 15, а потом получил ещё 8. Сколько наклеек стало у Пети?",
          "answer": "40"
        },
    
        {
          "type": "choice",
          "q": "У Ани было 40 конфет. Это на 7 больше, чем у Лены. Сколько конфет было у Лены?",
          "a": ["33", "47", "27", "30"],
          "c": 0
        },
        {
          "type": "choice",
          "q": "У Ани было 40 конфет. Это на 20 меньше, чем у Кати. Сколько конфет было у Кати?",
          "a": ["60", "20", "50", "70"],
          "c": 0
        },
        {
          "type": "input",
          "q": "У Ани было 40 конфет. Это на 7 больше, чем у Лены, и на 20 меньше, чем у Кати. Сколько конфет было у Лены?",
          "answer": "33"
        },
        {
          "type": "input",
          "q": "У Ани было 40 конфет. Это на 7 больше, чем у Лены, и на 20 меньше, чем у Кати. Сколько конфет было у Кати?",
          "answer": "60"
        },
    
        {
          "type": "choice",
          "q": "У Саши было 25 машинок. У Димы на 15 машинок больше. Сколько машинок у Димы?",
          "a": ["30", "35", "40", "45"],
          "c": 2
        },
        {
          "type": "choice",
          "q": "У Саши было 25 машинок. У Димы на 15 больше, чем у Саши. У Пети на 10 меньше, чем у Димы. Сколько машинок у Пети?",
          "a": ["30", "40", "25", "20"],
          "c": 0
        },
        {
          "type": "input",
          "q": "У Коли было 60 марок. Он подарил другу 18, а потом купил ещё 12. Сколько марок стало у Коли?",
          "answer": "54"
        },
        {
          "type": "choice",
          "q": "В школе было 80 тетрадей. Использовали 27, потом принесли ещё 12. Сколько тетрадей стало?",
          "a": ["65", "55", "75", "60"],
          "c": 0
        },
        {
          "type": "choice",
          "q": "У Оли было 36 карандашей. Ей подарили ещё 14, а потом ещё 20. Сколько стало карандашей?",
          "a": ["60", "70", "80", "90"],
          "c": 1
        },
        {
          "type": "input",
          "q": "В коробке было 70 кубиков. Добавили 18, потом убрали 9. Сколько кубиков стало?",
          "answer": "79"
        },
        {
          "type": "choice",
          "q": "У Кати было 29 наклеек. Подруга дала ещё 31, а потом Катя подарила 10. Сколько наклеек осталось?",
          "a": ["40", "50", "60", "70"],
          "c": 1
        },
        {
          "type": "choice",
          "q": "В коробке было 46 шариков. Добавили ещё 24, а потом ещё 10. Сколько стало шариков?",
          "a": ["70", "80", "60", "90"],
          "c": 1
        },
        {
          "type": "input",
          "q": "У Вани было 58 рублей. Он купил тетрадь за 18 рублей и ручку за 12 рублей. Сколько денег осталось?",
          "answer": "28"
        },
        {
          "type": "choice",
          "q": "На одной полке было 35 книг, на другой 27. Сколько всего книг на двух полках?",
          "a": ["52", "62", "72", "57"],
          "c": 1
        },
        {
          "type": "input",
          "q": "На одной полке 35 книг, на другой 27. Потом взяли 12 книг. Сколько книг осталось?",
          "answer": "50"
        }
      ]
    }
  ]
}
