{
  "version": 1,
  "meta": {
    "classId": "6",
    "subjectId": "math",
    "title": "Математика",
    "updated": "2026-03-05"
  },
  "paragraphs": [
    {
      "id": "review",
      "title": "Повторение",
      "summary": "Немного разомнёмся: задачи и уравнения. Пройди тест и проверь себя!",
      "image": null,
      "sections": [],
      "dates": [],
      "terms": [],
      "people": [],
      "quizzes": [
        {
          "id": "quiz-math-6-2",
          "title": "Решение задач и уравнений",
          "source": "manual"
        }
      ]
    }
  ],
  "quizzes": [
    {
      "id": "quiz-math-6-2",
      "title": "Решение задач и уравнений",
      "source": "manual",
      "difficulty": "medium",
      "questions": [
        {
          "type": "choice",
          "q": "Решите уравнение: 3(2x − 4) − 2(x − 5) = 14",
          "a": [
            "4",
            "5",
            "6",
            "7"
          ],
          "c": 1
        },
        {
          "type": "choice",
          "q": "В туристическую поездку поехали 28 человек. Билет для взрослого стоит 12 рублей, а для ребёнка — 8 рублей. Всего за билеты заплатили 272 рубля. Сколько было взрослых?",
          "a": [
            "12",
            "14",
            "16",
            "18"
          ],
          "c": 1
        },
        {
          "type": "choice",
          "q": "Решите уравнение: 4(x − 2) + 3(x + 1) = 23",
          "a": [
            "3",
            "4",
            "5",
            "6"
          ],
          "c": 2
        },
        {
          "type": "choice",
          "q": "В коробке лежат карандаши и ручки — всего 20 предметов. Карандаш стоит 3 рубля, ручка — 5 рублей. Общая стоимость всех предметов 76 рублей. Сколько в коробке ручек?",
          "a": [
            "10",
            "8",
            "6",
            "12"
          ],
          "c": 3
        },
        {
          "type": "choice",
          "q": "Решите уравнение: 3(1,5x + 2) − 4(x − 1) = 8",
          "a": [
            "9",
            "11",
            "12",
            "10"
          ],
          "c": 2
        },
        {
          "type": "choice",
          "q": "Денис читал повесть несколько дней. В первый день он прочитал 25% книги, во второй — 45%. После этого ему осталось прочитать ещё 30 страниц. Сколько страниц в повести?",
          "a": [
            "120",
            "180",
            "200",
            "150"
          ],
          "c": 4
        }
      ]
    }
  ]
}
